{
  "schema_version": 1,
  "rec_id": "example-0000000001",
  "created_at": "2026-10-16T14:05:00Z",
  "symbol": "NVDA",
  "side": "long",
  "qty": 120,
  "entry": {"type": "LMT", "limit_price": "141.20"},
  "stop_price": "139.85",
  "target_price": "143.60",
  "ttl_seconds": 600,
  "p": "0.63",
  "horizon_minutes": 45,
  "model_version": "example-0.0.0",
  "feature_versions": ["vwap_dev@1.0.0+0123456789ab", "rvol_open@1.0.0+ba9876543210"],
  "regime": "trend",
  "risk_checks": [
    {"check": "daily_loss_limit", "passed": true, "detail": "0.0% of 2.0% used"},
    {"check": "max_concurrent_positions", "passed": true, "detail": "0 of 3 open"},
    {"check": "pdt", "passed": true, "detail": "broker_pdt_active=true, 0 of 3 day trades used"}
  ]
}
